{
  "schema_version": "1.0",
  "mode": "draft",
  "expected_revision": 1,
  "selected_customer": null,
  "customer_reason": null,
  "no_actions_reason": null,
  "clarification_reason": null,
  "human_verified": false,
  "actions": [
    {
      "action_id": "ce36a61a-2933-51ad-87f2-10da966c8ff8",
      "source_index": 0,
      "title": "Vertretungsberechtigung belegen",
      "description": "Bestätigen Sie die Vertretungsberechtigung für das Testkonto bis zum 19.11.2026 mit einem aktuellen Registerauszug.",
      "decision": "pending",
      "assigned_to": null,
      "assignment_decision": "pending",
      "assignment_reason": null,
      "external_date": "2026-11-19",
      "external_date_basis": "Datum ausdrücklich im synthetischen Quelltext; unabhängige Prüfung ausstehend.",
      "internal_date": null,
      "scheduling_decision": "pending",
      "scheduling_reason": null,
      "rejection_reason": null,
      "needs_planning": true,
      "evidence": [
        {
          "page": 1,
          "quote": "Bestätigen Sie die Vertretungsberechtigung für das Testkonto bis zum 19.11.2026 mit einem aktuellen Registerauszug.",
          "verification": "matched"
        }
      ]
    }
  ]
}
