{
  "schema_version": "1.0",
  "mode": "confirm",
  "expected_revision": 1,
  "selected_customer": "SYN-CUSTOMER-A",
  "customer_reason": "Synthetischer Katalog und Original wurden ausdrücklich geprüft.",
  "no_actions_reason": null,
  "clarification_reason": null,
  "human_verified": true,
  "actions": [
    {
      "action_id": "62a58ed1-871f-5be8-847a-1f50ce4e506e",
      "source_index": 0,
      "title": "Beleggruppe 4 prüfen",
      "description": "Prüfen Sie die fiktive Beleggruppe 4 auf fehlende Zuordnungen.",
      "decision": "accept",
      "assigned_to": "operator-a@example.invalid",
      "assignment_decision": "assigned",
      "assignment_reason": null,
      "external_date": "2026-12-05",
      "external_date_basis": "Spätester Eingang: 05.12.2026.",
      "internal_date": "2026-11-15",
      "scheduling_decision": "scheduled",
      "scheduling_reason": null,
      "rejection_reason": null,
      "needs_planning": false,
      "evidence": [
        {
          "page": 1,
          "quote": "Prüfen Sie die fiktive Beleggruppe 4 auf fehlende Zuordnungen.",
          "verification": "matched"
        }
      ]
    },
    {
      "action_id": "277e5622-4762-5da5-aa82-40e14bfc1705",
      "source_index": 1,
      "title": "Rückmeldung 4 senden",
      "description": "Senden Sie anschließend eine getrennte Rückmeldung zur Musterprüfung 4.",
      "decision": "accept",
      "assigned_to": "operator-a@example.invalid",
      "assignment_decision": "assigned",
      "assignment_reason": null,
      "external_date": "2026-12-15",
      "external_date_basis": "Spätester Eingang: 15.12.2026.",
      "internal_date": "2026-11-15",
      "scheduling_decision": "scheduled",
      "scheduling_reason": null,
      "rejection_reason": null,
      "needs_planning": false,
      "evidence": [
        {
          "page": 1,
          "quote": "Senden Sie anschließend eine getrennte Rückmeldung zur Musterprüfung 4.",
          "verification": "matched"
        }
      ]
    }
  ]
}
