{
  "schema_version": "1.0",
  "mode": "draft",
  "expected_revision": 1,
  "selected_customer": null,
  "customer_reason": null,
  "no_actions_reason": null,
  "clarification_reason": null,
  "human_verified": false,
  "actions": [
    {
      "action_id": "23dc95e9-484f-55c2-b51d-d74f903df9f4",
      "source_index": 0,
      "title": "Berufliche Zustellanschrift mitteilen",
      "description": "Bitte teilen Sie die neue berufliche Zustellanschrift bis zum 20.11.2026 mit.",
      "decision": "pending",
      "assigned_to": null,
      "assignment_decision": "pending",
      "assignment_reason": null,
      "external_date": "2026-11-20",
      "external_date_basis": "Datum ausdrücklich im synthetischen Quelltext; unabhängige Prüfung ausstehend.",
      "internal_date": null,
      "scheduling_decision": "pending",
      "scheduling_reason": null,
      "rejection_reason": null,
      "needs_planning": true,
      "evidence": [
        {
          "page": 1,
          "quote": "Bitte teilen Sie die neue berufliche Zustellanschrift bis zum 20.11.2026 mit.",
          "verification": "matched"
        }
      ]
    }
  ]
}
