{
  "schema_version": "1.0",
  "mode": "draft",
  "expected_revision": 1,
  "selected_customer": null,
  "customer_reason": null,
  "no_actions_reason": null,
  "clarification_reason": null,
  "human_verified": false,
  "actions": [
    {
      "action_id": "e3a31f90-703c-5474-b2e4-60c567e8b768",
      "source_index": 0,
      "title": "Bitte antworten Sie innerhalb von 14 Tagen nach Zugang dieses Schreibens.",
      "description": "Bitte antworten Sie innerhalb von 14 Tagen nach Zugang dieses Schreibens.",
      "decision": "pending",
      "assigned_to": null,
      "assignment_decision": "pending",
      "assignment_reason": null,
      "external_date": null,
      "external_date_basis": null,
      "internal_date": null,
      "scheduling_decision": "pending",
      "scheduling_reason": null,
      "rejection_reason": null,
      "needs_planning": true,
      "evidence": [
        {
          "page": 1,
          "quote": "Bitte antworten Sie innerhalb von 14 Tagen nach Zugang dieses Schreibens.",
          "verification": "matched"
        }
      ]
    }
  ]
}
