{
  "schema_version": "1.0",
  "mode": "draft",
  "expected_revision": 1,
  "selected_customer": null,
  "customer_reason": null,
  "no_actions_reason": null,
  "clarification_reason": null,
  "human_verified": false,
  "actions": [
    {
      "action_id": "4fb68528-c3d1-5d80-823b-cdd8587ce27c",
      "source_index": 0,
      "title": "Geförderte Strommengen aufstellen",
      "description": "Übermitteln Sie die getrennte Aufstellung der geförderten Strommengen bis zum 09.11.2026.",
      "decision": "pending",
      "assigned_to": null,
      "assignment_decision": "pending",
      "assignment_reason": null,
      "external_date": "2026-11-09",
      "external_date_basis": "Datum ausdrücklich im synthetischen Quelltext; unabhängige Prüfung ausstehend.",
      "internal_date": null,
      "scheduling_decision": "pending",
      "scheduling_reason": null,
      "rejection_reason": null,
      "needs_planning": true,
      "evidence": [
        {
          "page": 1,
          "quote": "Übermitteln Sie die getrennte Aufstellung der geförderten Strommengen bis zum 09.11.2026.",
          "verification": "matched"
        }
      ]
    }
  ]
}
