{
  "schema_version": "1.0",
  "mode": "confirm",
  "expected_revision": 1,
  "selected_customer": "SYN-CUSTOMER-A",
  "customer_reason": "Manuell anhand des synthetischen Kundenkatalogs geprüft.",
  "no_actions_reason": "Nach vollständiger Prüfung besteht kein Handlungsbedarf.",
  "clarification_reason": null,
  "human_verified": true,
  "actions": []
}
