{
  "schema_version": "1.0",
  "mode": "clarification",
  "expected_revision": 1,
  "selected_customer": "SYN-CUSTOMER-A",
  "customer_reason": "Manuell anhand des synthetischen Kundenkatalogs geprüft.",
  "no_actions_reason": null,
  "clarification_reason": "Mandant oder Inhalt muss geklärt werden.",
  "human_verified": false,
  "actions": [
    {
      "action_id": "77d015be-e22e-5c27-95d6-f577cc421ba6",
      "source_index": 0,
      "title": "Unterlagen einreichen",
      "description": "Bitte die angeforderten Unterlagen einreichen.",
      "decision": "pending",
      "assigned_to": null,
      "assignment_decision": "pending",
      "assignment_reason": null,
      "external_date": null,
      "external_date_basis": null,
      "internal_date": null,
      "scheduling_decision": "pending",
      "scheduling_reason": null,
      "rejection_reason": null,
      "needs_planning": false,
      "evidence": [
        {
          "page": 1,
          "quote": "Bitte die angeforderten Unterlagen einreichen.",
          "verification": "matched"
        }
      ]
    }
  ]
}
