{
  "schema_version": "1.0",
  "mode": "confirm",
  "expected_revision": 1,
  "selected_customer": "SYN-CUSTOMER-A",
  "customer_reason": "Synthetischer Katalog und Original wurden ausdrücklich geprüft.",
  "no_actions_reason": null,
  "clarification_reason": null,
  "human_verified": true,
  "actions": [
    {
      "action_id": "bd12e981-6835-59f7-b816-fd2623888fd4",
      "source_index": 0,
      "title": "Bankauszug ergänzen",
      "description": "Ergänzen Sie die fehlende Seite des künstlichen Bankauszugs.",
      "decision": "accept",
      "assigned_to": "operator-a@example.invalid",
      "assignment_decision": "assigned",
      "assignment_reason": null,
      "external_date": "2026-12-14",
      "external_date_basis": "Spätester Eingang: 14.12.2026.",
      "internal_date": "2026-11-15",
      "scheduling_decision": "scheduled",
      "scheduling_reason": null,
      "rejection_reason": null,
      "needs_planning": false,
      "evidence": [
        {
          "page": 1,
          "quote": "Ergänzen Sie die fehlende Seite des künstlichen Bankauszugs.",
          "verification": "matched"
        }
      ]
    }
  ]
}
