{
  "schema_version": "1.0",
  "mode": "confirm",
  "expected_revision": 1,
  "selected_customer": "SYN-CUSTOMER-A",
  "customer_reason": "Manuell anhand des synthetischen Kundenkatalogs geprüft.",
  "no_actions_reason": null,
  "clarification_reason": null,
  "human_verified": true,
  "actions": [
    {
      "action_id": "afd354b3-ec18-5340-95c1-4b78d24f27f0",
      "source_index": 0,
      "title": "Unterlagen einreichen",
      "description": "Bitte die angeforderten Unterlagen einreichen.",
      "decision": "accept",
      "assigned_to": "operator-a@example.invalid",
      "assignment_decision": "assigned",
      "assignment_reason": null,
      "external_date": null,
      "external_date_basis": null,
      "internal_date": null,
      "scheduling_decision": "unscheduled",
      "scheduling_reason": "Termin wird nach Rücksprache geplant.",
      "rejection_reason": null,
      "needs_planning": true,
      "evidence": [
        {
          "page": 1,
          "quote": "Bitte die angeforderten Unterlagen einreichen.",
          "verification": "matched"
        }
      ]
    }
  ]
}
