{
  "schema_version": "1.0",
  "mode": "draft",
  "expected_revision": 1,
  "selected_customer": null,
  "customer_reason": null,
  "no_actions_reason": null,
  "clarification_reason": null,
  "human_verified": false,
  "actions": [
    {
      "action_id": "8d0e96f6-6554-5ca7-bcb4-140c5e590966",
      "source_index": 0,
      "title": "Ausgabenübersicht einreichen",
      "description": "Reichen Sie die unterschriebene Ausgabenübersicht bis zum 24.11.2026 ein.",
      "decision": "pending",
      "assigned_to": null,
      "assignment_decision": "pending",
      "assignment_reason": null,
      "external_date": "2026-11-24",
      "external_date_basis": "Datum ausdrücklich im synthetischen Quelltext; unabhängige Prüfung ausstehend.",
      "internal_date": null,
      "scheduling_decision": "pending",
      "scheduling_reason": null,
      "rejection_reason": null,
      "needs_planning": true,
      "evidence": [
        {
          "page": 1,
          "quote": "Reichen Sie die unterschriebene Ausgabenübersicht bis zum 24.11.2026 ein.",
          "verification": "matched"
        }
      ]
    },
    {
      "action_id": "7c9d3302-d798-53d3-8a1a-7b4ad8daaa30",
      "source_index": 1,
      "title": "Eigenmittel nachweisen",
      "description": "Legen Sie den Nachweis der Eigenmittel bis zum 26.11.2026 vor.",
      "decision": "pending",
      "assigned_to": null,
      "assignment_decision": "pending",
      "assignment_reason": null,
      "external_date": "2026-11-26",
      "external_date_basis": "Datum ausdrücklich im synthetischen Quelltext; unabhängige Prüfung ausstehend.",
      "internal_date": null,
      "scheduling_decision": "pending",
      "scheduling_reason": null,
      "rejection_reason": null,
      "needs_planning": true,
      "evidence": [
        {
          "page": 2,
          "quote": "Legen Sie den Nachweis der Eigenmittel bis zum 26.11.2026 vor.",
          "verification": "matched"
        }
      ]
    }
  ]
}
