{
  "schema_version": "1.0",
  "mode": "confirm",
  "expected_revision": 1,
  "selected_customer": "SYN-CUSTOMER-A",
  "customer_reason": "Synthetischer Katalog und Original wurden ausdrücklich geprüft.",
  "no_actions_reason": null,
  "clarification_reason": null,
  "human_verified": true,
  "actions": [
    {
      "action_id": "f7205cb6-99b9-5e97-a8bd-9f5b550d4a76",
      "source_index": 0,
      "title": "Musterkalkulation prüfen",
      "description": "Prüfen Sie die synthetische Kalkulation INJ-26 und senden Sie eine Rückmeldung.",
      "decision": "accept",
      "assigned_to": "operator-a@example.invalid",
      "assignment_decision": "assigned",
      "assignment_reason": null,
      "external_date": "2026-12-28",
      "external_date_basis": "Spätester Eingang: 28.12.2026.",
      "internal_date": "2026-11-15",
      "scheduling_decision": "scheduled",
      "scheduling_reason": null,
      "rejection_reason": null,
      "needs_planning": false,
      "evidence": [
        {
          "page": 1,
          "quote": "Prüfen Sie die synthetische Kalkulation INJ-26 und senden Sie eine Rückmeldung.",
          "verification": "matched"
        }
      ]
    }
  ]
}
