{
  "schema_version": "1.0",
  "mode": "confirm",
  "expected_revision": 1,
  "selected_customer": "SYN-CUSTOMER-A",
  "customer_reason": "Synthetischer Katalog und Original wurden ausdrücklich geprüft.",
  "no_actions_reason": "Reine synthetische Empfangsbestätigung; keine Handlung erforderlich.",
  "clarification_reason": null,
  "human_verified": true,
  "actions": []
}
