{
  "schema_version": "1.0",
  "mode": "draft",
  "expected_revision": 1,
  "selected_customer": null,
  "customer_reason": null,
  "no_actions_reason": null,
  "clarification_reason": null,
  "human_verified": false,
  "actions": [
    {
      "action_id": "0bddddd0-4526-5b8a-9ab9-894911eed3cb",
      "source_index": 0,
      "title": "Redaktionelle Zuständigkeit beschreiben",
      "description": "Bitte beschreiben Sie die redaktionelle Zuständigkeit für den barrierefreien Internetauftritt.",
      "decision": "pending",
      "assigned_to": null,
      "assignment_decision": "pending",
      "assignment_reason": null,
      "external_date": null,
      "external_date_basis": null,
      "internal_date": null,
      "scheduling_decision": "pending",
      "scheduling_reason": null,
      "rejection_reason": null,
      "needs_planning": true,
      "evidence": [
        {
          "page": 1,
          "quote": "Bitte beschreiben Sie die redaktionelle Zuständigkeit für den barrierefreien Internetauftritt.",
          "verification": "matched"
        }
      ]
    }
  ]
}
