{
  "schema_version": "1.0",
  "mode": "draft",
  "expected_revision": 1,
  "selected_customer": null,
  "customer_reason": null,
  "no_actions_reason": null,
  "clarification_reason": null,
  "human_verified": false,
  "actions": [
    {
      "action_id": "ee35a859-c8c0-5898-b8c5-8223cb963fa0",
      "source_index": 0,
      "title": "Forderungssaldo bestätigen",
      "description": "Bitte bestätigen Sie den Saldo der angemeldeten Lieferforderung bis zum 04.12.2026.",
      "decision": "pending",
      "assigned_to": null,
      "assignment_decision": "pending",
      "assignment_reason": null,
      "external_date": "2026-12-04",
      "external_date_basis": "Datum ausdrücklich im synthetischen Quelltext; unabhängige Prüfung ausstehend.",
      "internal_date": null,
      "scheduling_decision": "pending",
      "scheduling_reason": null,
      "rejection_reason": null,
      "needs_planning": true,
      "evidence": [
        {
          "page": 1,
          "quote": "Bitte bestätigen Sie den Saldo der angemeldeten Lieferforderung bis zum 04.12.2026.",
          "verification": "matched"
        }
      ]
    }
  ]
}
