{
  "schema_version": "1.0",
  "mode": "clarification",
  "expected_revision": 1,
  "selected_customer": "SYN-CUSTOMER-A",
  "customer_reason": "Synthetischer Katalog und Original wurden ausdrücklich geprüft.",
  "no_actions_reason": null,
  "clarification_reason": "Synthetischer Sonderfall benötigt eine ausdrückliche Klärung.",
  "human_verified": false,
  "actions": [
    {
      "action_id": "389f2914-1a40-58e5-bf09-bab96ab327d0",
      "source_index": 0,
      "title": "Frist im Musterauftrag klären",
      "description": "Prüfen Sie den fiktiven Korrekturauftrag U2 und reichen Sie die Ergänzung ein.",
      "decision": "pending",
      "assigned_to": null,
      "assignment_decision": "pending",
      "assignment_reason": null,
      "external_date": null,
      "external_date_basis": null,
      "internal_date": null,
      "scheduling_decision": "pending",
      "scheduling_reason": null,
      "rejection_reason": null,
      "needs_planning": false,
      "evidence": [
        {
          "page": 1,
          "quote": "Prüfen Sie den fiktiven Korrekturauftrag U2 und reichen Sie die Ergänzung ein.",
          "verification": "matched"
        }
      ]
    }
  ]
}
